ID,TYPE,DAMAGE_RATING,EFFECTS,DAMAGE_TYPE,FIRE_RATE,RANGE,QUALITIES,WEIGHT,COST,RARITY,DESCRIPTION,AMMO_TYPE,AVAILABLE_MODS
weaponLaserPistol,energyWeapons,4,"[""effectPiercing 1""]",Da Energia,2,rangeC,"[""qualityCloseQuarters""]",2,69,2,"Le pistole laser sono armi tecnologiche in grado di emettere un raggio di luce direzionale coeso e abbastanza intenso da causare gravi danni. Negli anni prima della Grande Guerra erano un’evoluzione relativamente nuova, per cui è difficile trovarle nella Zona Contaminata, al di fuori dei gruppi che sono riusciti ad accaparrarsi i vecchi depositi delle armi dell’esercito. La maggior parte dei modelli sopravvissuti di pistole laser, come l’affidabile AER9, ampiamente usata dall’esercito americano, si serve di un condensatore interno caricato da una batteria a microfusione. La configurazione di base si riferisce a una pistola laser che può montare una per tipo delle seguenti modifiche. Ogni mod Calcio la trasforma in un fucile laser.",ammoFusionCell,"Bocca (Concentratore di Raggio, Lenti di Compensazione Circolari, Separatore di Raggio), Calcio (Calcio da Tiratore Scelto, Calcio per Compensazione del Rinculo, Calcio Standard), Canna (Canna Lunga, Canna Automatica, Canna da Cecchino, Canna Migliorata), Condensatore (Stimolatore Fotonico, Sintonizzatore di Onde Beta, Condensatore Potenziato, Agitatore Fotonico), Impugnatura (Impugnatura da Tiratore Esperto), Mirino (Mirino Reflex, Mirino Corto, Mirino Lungo, Mirino Corto Visione Notturna, Mirino Lungo Visione Notturna, Mirino da Ricognizione)"
weaponInstituteLaser,energyWeapons,3,"[""effectBurst""]",Da Energia,3,rangeC,"[""qualityCloseQuarters"", ""qualityInaccurate""]",2,50,2,"Sviluppati dall’Istituto dopo la Grande Guerra, i laser dell’istituto sono diversi sia nell’aspetto che nella funzione rispetto a quelli dell’anteguerra che vengono utilizzati da altre fazioni, come la Confraternita d’Acciaio. Rinunciando alla potenza di fuoco in favore di una rapida successione di raggi, possono riversare una pioggia incandescente di fuoco di sbarramento. La configurazione di base si riferisce a una pistola laser dell’Istituto, che può montare una per tipo delle seguenti modifiche. Ogni mod Calcio trasforma l’arma in un fucile laser dell’Istituto.",ammoFusionCell,"Bocca (Concentratore di Raggio, Lenti di Compensazione Circolari, Separatore di Raggio), Calcio (Calcio Standard), Canna (Canna Automatica, Canna Lunga, Canna Migliorata), Condensatore (Agitatore Fotonico, Condensatore Potenziato, Sintonizzatore di Onde Beta, Stimolatore Fotonico), Mirino (Mirino Corto, Mirino Corto Visione Notturna, Mirino da Ricognizione, Mirino Lungo, Mirino Lungo Visione Notturna, Mirino Reflex)"
weaponLaserMusket,energyWeapons,5,"[""effectPiercing 1""]",Da Energia,0,rangeM,"[""qualityTwoHanded""]",6.5,57,1,"Il moschetto laser è un tipo di fucile laser artigianale che unisce una tecnologia avanzata con dei meccanismi insolitamente primitivi ed è molto diffuso tra le milizie come i Minutemen. Deve essere caricato manualmente, girando una manovella sul retro dell’arma. Sebbene sembri rozzo, può essere un’ottima arma da cecchino, soprattutto con un condensatore modificato in grado di sostenere una carica maggiore.",ammoFusionCell,"Bocca (Concentratore di Raggio, Lenti di Compensazione Circolari, Separatore di Raggio), Calcio (Calcio Completo), Canna (Canna Corta Rinforzata, Canna Lunga, Canna Lunga Rinforzata), Condensatore (Condensatore a Tre Cariche, Condensatore a Quattro Cariche, Condensatore a Cinque Cariche, Condensatore a Sei Cariche), Mirino (Mirino Corto, Mirino Corto Visione Notturna, Mirino da Ricognizione, Mirino Lungo, Mirino Lungo Visione Notturna, Mirino Reflex)"
weaponPlasmaPistol,energyWeapons,6,[],"Fisico / Da Energia",1,rangeC,"[""qualityCloseQuarters""]",2,123,3,"Le armi al plasma, dette anche plasmacaster, sono delle armi altamente tecnologiche che sparano gas ionizzato ad altissime temperature, o plasma. Queste armi, che funzionano con cartucce al plasma, sono rare e molto potenti, in grado come sono di arrecare danno attraverso l’impatto ad alta velocità del raggio al plasma e, successivamente, con il trasferimento termico del calore che viene riversato sul bersaglio al momento dell’impatto.",ammoPlasmaCartridge,"Calcio (Calcio da Tiratore Scelto, Calcio per Compensazione del Rinculo, Calcio Standard), Canna (Canna Automatica, Canna da Cecchino, Canna Lanciafiamme, Canna Migliorata, Separatore), Condensatore (Agitatore Fotonico, Condensatore Potenziato, Sintonizzatore di Onde Beta, Stimolatore Fotonico), Mirino (Mirino Corto, Mirino Corto Visione Notturna, Mirino da Ricognizione, Mirino Lungo, Mirino Lungo Visione Notturna, Mirino Reflex)"
weaponGammaPistol,energyWeapons,3,"[""effectPiercing 1"",""effectStunned""]",Da Radiazioni,1,rangeM,"[""qualityBlast"", ""qualityInaccurate""]",1.5,156,5,"La pistola gamma, col suo aspetto apparentemente rozzo, emette dei raggi direzionali di radiazioni ionizzanti ad alta intensità, che possono essere devastanti per qualsiasi creatura non sia immune o incredibilmente resistente alle radiazioni ma, al contempo, non fanno quasi alcun danno sugli altri bersagli.",ammoGammaRound,"Bocca (Concentratore di Raggio, Lenti di Compensazione Circolari, Separatore di Raggio), Calcio (Calcio da Tiratore Scelto, Calcio per Compensazione del Rinculo, Calcio Standard), Canna (Canna Lunga, Canna Automatica, Canna da Cecchino, Canna Migliorata), Condensatore (Stimolatore Fotonico, Sintonizzatore di Onde Beta, Condensatore Potenziato, Agitatore Fotonico), Impugnatura (Impugnatura da Tiratore Esperto), Mirino (Mirino Reflex, Mirino Corto, Mirino Lungo, Mirino Corto Visione Notturna, Mirino Lungo Visione Notturna, Mirino da Ricognizione)"